{
  "version":"0.1.0",
  "request_id":"CHG-HOSP-001",
  "domain":"healthcare-platform",
  "source_text":"AI 판독 기능은 제외하고 환자용 모바일 서비스와 알림을 추가한다.",
  "base_configuration_id":"GOLD-BASE-HOSP-001",
  "intents":[
    {"id":"INT-001","operation":"exclude","subject":"AI 판독","feature_candidates":[{"feature_id":"ai_diagnosis","score":0.99}],"confidence":0.99,"source_quote":"AI 판독 기능은 제외"},
    {"id":"INT-002","operation":"include","subject":"환자 모바일","feature_candidates":[{"feature_id":"patient_mobile","score":0.99}],"confidence":0.99,"source_quote":"환자용 모바일 서비스를 추가"},
    {"id":"INT-003","operation":"include","subject":"환자 알림","feature_candidates":[{"feature_id":"patient_notifications","score":0.98}],"confidence":0.98,"source_quote":"알림을 추가"}
  ],
  "functional_requirements":[
    {"id":"FR-001","statement":"AI 판독 기능을 제거한다.","priority":"must","acceptance_test_ids":["AT-AI-003"]},
    {"id":"FR-002","statement":"환자 모바일 서비스와 알림을 제공한다.","priority":"must","acceptance_test_ids":["AT-MOB-001","AT-MOB-002"]}
  ],
  "non_functional_requirements":[
    {"id":"NFR-001","category":"security","statement":"환자 모바일 인증은 OIDC를 사용한다.","measure":"OIDC Contract Test가 통과해야 한다."}
  ],
  "constraints":[
    {"id":"RC-001","kind":"feature","expression":"ai_diagnosis = false","hard":true},
    {"id":"RC-002","kind":"feature","expression":"patient_mobile = true","hard":true}
  ],
  "deployment":{"profile":"unchanged","runtime":"unchanged"},
  "data_classes":["PHI","personal","credential"],
  "unresolved_questions":[],
  "metadata":{"created_at":"2026-09-22T00:01:00Z","producer":"hybrid","model_id":"design-baseline","prompt_template_version":"0.1.0"}
}

